{
  "format": "open-values-register-evidence-bundle",
  "version": "1.0.0",
  "registerId": "france-durability",
  "criterion": "durability",
  "snapshot": {
    "snapshotId": "2026-08-14-3d8a07c29d1f",
    "capturedAt": "2026-08-14T19:40:54Z",
    "queryUrl": "https://www.data.gouv.fr/fr/datasets/r/53b4d56e-5e23-4e52-9527-9921ef1934d0",
    "scope": "French consolidated washing-machine durability index schema v0.1.1, latest-version resource published 2026-08-14; model-level filings only",
    "payloadSha256": "3b8ea70c2c6a87285d050a3a9cd22b12abc0ef50155eafc86d2c4c24b4f68127"
  },
  "generatedFrom": {
    "snapshotManifest": "pipeline/registers/raw/france-durability/2026-08-14-3d8a07c29d1f.snapshot.json",
    "snapshotManifestSha256": "7d9135dffda8c11b3d558a0950512dd58b9a2509d6b0bf4308cfeaf5d6ce8f8e",
    "mapping": "content/register-mappings/france-durability.json",
    "mappingSha256": "82f571969c7685c26782def4bccd09f6c93dd3b6fd627799113d7343f7be54da",
    "observations": "pipeline/registers/observations/france-durability-2026-08-14-3d8a07c29d1f.observations.json",
    "observationsSha256": "c28a74bfd96c1288b8db5e930e258c918543e4c2b7c00768246019b38d47c524",
    "coverageMatrixSha256": "d73d50f2baa512d7a63e0f25b71cb0b4f94fd9bdfb4917bbee8035b8e74ce0d7",
    "generatorVersion": "1.1.0"
  },
  "counts": {
    "matchedMappings": 3,
    "recordsFound": 3,
    "scopedAbsences": 0,
    "entries": 3
  },
  "reviewRequirement": {
    "method": "lowest-sha256-of-bundle-inputs-and-entry-id",
    "sampleSize": 3,
    "entryIds": [
      "washing-machines/hotpoint-hb93-care",
      "washing-machines/samsung-ww80t4020ehef",
      "washing-machines/whirlpool-w0m310wads"
    ]
  },
  "entries": [
    {
      "entryId": "washing-machines/hotpoint-hb93-care",
      "cid": "washing-machines",
      "entityCode": "hotpoint-hb93-care",
      "entityName": "Hotpoint HB 93 Care",
      "entityIdentitySha256": "907a97820316730ac91adcebfa8d46b64e737fca7a5443b990132c5eead332dc",
      "legalName": "HOTPOINT",
      "registerIdentifier": {
        "scheme": "fr-durability-id-unique",
        "value": "5054645730704-FR001088_05WVDO-2026-03-12"
      },
      "mappingReview": {
        "by": "Codex Phase 8 exact model review",
        "on": "2026-08-14"
      },
      "outcome": "records-found",
      "searchTerms": [
        "5054645730704",
        "5054645730704-FR001088_05WVDO-2026-03-12",
        "HB93CAREFR_869991730700"
      ],
      "recordTrace": [
        {
          "id": "frdur-6b93554046aedf8f",
          "pointer": "row:734"
        }
      ],
      "provenance": {
        "note": "For HOTPOINT, Indice de durabilite returned 1 matching record. Calculation date: 2026-03-12; Durability index: 8.91 out of 10; Model: HB93CAREFR_869991730700; Model identifier: 5054645730704; Model identifier scheme: GTIN_EAN; Producer: HOTPOINT; Reliability component: 8.77 out of 10; Repairability component: 9.05 out of 10. Search terms: 5054645730704, 5054645730704-FR001088_05WVDO-2026-03-12, HB93CAREFR_869991730700. Scope: French consolidated washing-machine durability index schema v0.1.1, latest-version resource published 2026-08-14; model-level filings only. Snapshot captured 2026-08-14.",
        "source": "https://www.data.gouv.fr/fr/datasets/r/53b4d56e-5e23-4e52-9527-9921ef1934d0",
        "asof": "2026"
      }
    },
    {
      "entryId": "washing-machines/samsung-ww80t4020ehef",
      "cid": "washing-machines",
      "entityCode": "samsung-ww80t4020ehef",
      "entityName": "Samsung WW80T4020EHEF",
      "entityIdentitySha256": "cf36ad0aa959b328929361008f4e79964e2ad18a5bd33a461dc26df1ec366aca",
      "legalName": "SAMSUNG",
      "registerIdentifier": {
        "scheme": "fr-durability-id-unique",
        "value": "WW80T4020EHEF-SEF-2025-02-27"
      },
      "mappingReview": {
        "by": "Codex Phase 8 exact model review",
        "on": "2026-08-14"
      },
      "outcome": "records-found",
      "searchTerms": [
        "WW80T4020EHEF",
        "WW80T4020EHEF-SEF-2025-02-27"
      ],
      "recordTrace": [
        {
          "id": "frdur-e2b18307cf58852a",
          "pointer": "row:1493"
        }
      ],
      "provenance": {
        "note": "For SAMSUNG, Indice de durabilite returned 1 matching record. Calculation date: 2025-02-27; Durability index: 7.75 out of 10; Model: WW80T4020EHEF; Model identifier: WW80T4020EHEF; Model identifier scheme: GTIN_EAN; Producer: SAMSUNG; Reliability component: 6.13 out of 10; Repairability component: 9.36 out of 10. Search terms: WW80T4020EHEF, WW80T4020EHEF-SEF-2025-02-27. Scope: French consolidated washing-machine durability index schema v0.1.1, latest-version resource published 2026-08-14; model-level filings only. Snapshot captured 2026-08-14.",
        "source": "https://www.data.gouv.fr/fr/datasets/r/53b4d56e-5e23-4e52-9527-9921ef1934d0",
        "asof": "2026"
      }
    },
    {
      "entryId": "washing-machines/whirlpool-w0m310wads",
      "cid": "washing-machines",
      "entityCode": "whirlpool-w0m310wads",
      "entityName": "Whirlpool W0M310WADS",
      "entityIdentitySha256": "a9a76ca2fb21c2e97ada151abb1aff18cf89b9bc290ab0812554ca96436c0e3b",
      "legalName": "WHIRLPOOL",
      "registerIdentifier": {
        "scheme": "fr-durability-id-unique",
        "value": "8690842895661-FR001088_05WVDO-2026-04-21"
      },
      "mappingReview": {
        "by": "Codex Phase 8 exact model review",
        "on": "2026-08-14"
      },
      "outcome": "records-found",
      "searchTerms": [
        "8690842895661",
        "8690842895661-FR001088_05WVDO-2026-04-21",
        "W0M310WADSFR_859993354280"
      ],
      "recordTrace": [
        {
          "id": "frdur-0d6c7d7bbeefb328",
          "pointer": "row:671"
        }
      ],
      "provenance": {
        "note": "For WHIRLPOOL, Indice de durabilite returned 1 matching record. Calculation date: 2026-04-21; Durability index: 8.87 out of 10; Model: W0M310WADSFR_859993354280; Model identifier: 8690842895661; Model identifier scheme: GTIN_EAN; Producer: WHIRLPOOL; Reliability component: 8.77 out of 10; Repairability component: 8.97 out of 10. Search terms: 8690842895661, 8690842895661-FR001088_05WVDO-2026-04-21, W0M310WADSFR_859993354280. Scope: French consolidated washing-machine durability index schema v0.1.1, latest-version resource published 2026-08-14; model-level filings only. Snapshot captured 2026-08-14.",
        "source": "https://www.data.gouv.fr/fr/datasets/r/53b4d56e-5e23-4e52-9527-9921ef1934d0",
        "asof": "2026"
      }
    }
  ]
}
